{"artifact_schema_version":"monitoring_report_artifact.v1","code_version":"93e488b02086","config_hash":"3e271c52aea73d4ac83b87ce807b746f773fdc7c656ef437f9d8442aa33beb20","generated_at_utc":"2026-02-01T00:00:00+00:00","health_status":"WARN","health_summary":{"fail_codes":[],"n_fail_codes":0,"n_flags":4,"n_warnings":4,"sources":{"forecast":{"flags":0,"warnings":0},"performance":{"flags":2,"warnings":2},"pipeline":{"flags":1,"warnings":3},"risk":{"flags":1,"warnings":1}}},"input_forecast_artifact_hash":"ffffffffffffffffffffffffffffffffffffffffffffffffffffffffffffffff","input_forecast_run_id":"forecast-run-sample","input_performance_artifact_hash":"c69922a68c2af51e45a7ccb264bf3c71b6e5ee69710a3821bcd2e154c008b04d","input_performance_run_id":"60623389e28556389848db880aa951af","input_pipeline_artifact_hash":"3e0aac01d441d2da92c220f1bdfa99c20254f55198ee342ba3fb9a1d99a42558","input_pipeline_run_id":"6660927e5b6154c0a9688890518fc7d9","input_risk_artifact_hash":"d75d4f61cef96b6d1103ff3d51e1a7aa94a45d54085ceaaed7004dffa0e816a7","input_risk_run_id":"96a62dd0a7e257a3b71ed7f9f5e6209b","monitoring_inputs_hash":"79985156e4a5242f13301c9a0d19acf5fce60795588ccfefa6cf004a90698787","monitoring_payload_hash":"5c482f72e8d719f5a0caa144234043a46926dc21a217d96db0ff9a5d8aa77df1","monitoring_policy_hash":"c9da042bdcff575cd63021c186ec04512c61b80dba8c9dbe60fdd31297324860","monitoring_policy_version":"monitoring_policy.v1","params":{"artifacts_root":"artifacts","fail_on_critical_block":true,"warn_on_any_quality_signal":true},"quality_flags":["extreme_concentration_top3","illiquid","insufficient_inputs","performance_concentration_top3_breach"],"quality_warnings":[{"code":"extreme_concentration_top3","message":"Portfolio run 38eb02ea3f37503a9809e8e044d244ca top3 notional share 1.000000 exceeds threshold 0.800000.","source":"performance"},{"code":"illiquid","message":"Top depth below threshold.","source":"pipeline"},{"code":"insufficient_inputs","message":"Performance report built with fewer than two portfolio artifacts; aggregate stability is limited.","source":"performance"},{"code":"performance_concentration_top3_breach","message":"Historical top3 share 1.000000 exceeds cap 0.800000.","source":"risk"}],"run_id":"d948d136d3b25e36bc5ddd971fa40a4f"}