{"artifact_schema_version":"monitoring_report_artifact.v1","code_version":"93e488b02086","config_hash":"7c58c49c4bca5a109e7c23e07b797c3fd7192cf0b9711d1a0a8c6b8cfe5434dd","generated_at_utc":"2026-02-16T06:22:13+00:00","health_status":"WARN","health_summary":{"fail_codes":[],"n_fail_codes":0,"n_flags":6,"n_warnings":10,"sources":{"forecast":{"flags":4,"warnings":4},"performance":{"flags":2,"warnings":2},"pipeline":{"flags":4,"warnings":4},"risk":{"flags":0,"warnings":0}}},"input_forecast_artifact_hash":"4f53cda18c2baa0c0354bb5f9a3ecbe5ed12ab4d8e11ba873c2f11161202b945","input_forecast_run_id":"916a36568aa957fa9695fa7efbc244c9","input_performance_artifact_hash":"4ab18d4f94fc38a5b833cd215cb704f4611f0b0a6e16c0d52cad3ecdc0a93585","input_performance_run_id":"97e4b2e448e55c20a89f65f3e70df6b0","input_pipeline_artifact_hash":"0b74f32b9b2ba9a7b8c06ad472ee97d002bb7145693843196490c7bdc4ec69d9","input_pipeline_run_id":"4952729ce45953aca42db3a74b5c4491","input_risk_artifact_hash":"245e9e9828c0029d768c1aa5208ce7b8a0f4546bf8b40a7e639eee33b1083f24","input_risk_run_id":"b36c65ba243c5d0986b5c147bb3efae6","monitoring_inputs_hash":"75fc8a8f7c9cc3f6b4ac27e116599267853ba7d2cb9d7e535d52eaa95ff7b8ac","monitoring_payload_hash":"fdf20d19bf702e90aa8a82b3b8a76528c7ee0bea6bcf366c08c7737d52dca523","monitoring_policy_hash":"c9da042bdcff575cd63021c186ec04512c61b80dba8c9dbe60fdd31297324860","monitoring_policy_version":"monitoring_policy.v1","params":{"artifacts_root":"artifacts","fail_on_critical_block":true,"warn_on_any_quality_signal":true},"quality_flags":["coverage_below_target_50","coverage_below_target_90","insufficient_calibration_data","insufficient_inputs","insufficient_uncertainty_data","zero_notional"],"quality_warnings":[{"code":"coverage_below_target_50","message":"Observed 50% interval coverage below target.","source":"forecast"},{"code":"coverage_below_target_50","message":"Observed 50% interval coverage below target.","source":"pipeline"},{"code":"coverage_below_target_90","message":"Observed 90% interval coverage below target.","source":"forecast"},{"code":"coverage_below_target_90","message":"Observed 90% interval coverage below target.","source":"pipeline"},{"code":"insufficient_calibration_data","message":"Calibration quality gate: insufficient eval sample size.","source":"forecast"},{"code":"insufficient_calibration_data","message":"Calibration quality gate: insufficient eval sample size.","source":"pipeline"},{"code":"insufficient_inputs","message":"Performance report built with fewer than two portfolio artifacts; aggregate stability is limited.","source":"performance"},{"code":"insufficient_uncertainty_data","message":"Uncertainty report has insufficient sample size.","source":"forecast"},{"code":"insufficient_uncertainty_data","message":"Uncertainty report has insufficient sample size.","source":"pipeline"},{"code":"zero_notional","message":"Portfolio run d905a7bcd0b75ba690f585276b979bf3 has zero notional exposure.","source":"performance"}],"run_id":"19e46886e1955fd5a42c819079c22edf"}