{"artifact_schema_version":"monitoring_report_artifact.v1","code_version":"93e488b02086","config_hash":"88365fc9cf140e61264912c141c2ad5635d952f63b675e8ca315703bf523b5a6","generated_at_utc":"2026-02-16T06:22:13+00:00","health_status":"WARN","health_summary":{"fail_codes":[],"n_fail_codes":0,"n_flags":6,"n_warnings":10,"sources":{"forecast":{"flags":4,"warnings":4},"performance":{"flags":2,"warnings":2},"pipeline":{"flags":4,"warnings":4},"risk":{"flags":0,"warnings":0}}},"input_forecast_artifact_hash":"4f53cda18c2baa0c0354bb5f9a3ecbe5ed12ab4d8e11ba873c2f11161202b945","input_forecast_run_id":"916a36568aa957fa9695fa7efbc244c9","input_performance_artifact_hash":"c5077cf6f42ff118e01e2a39e9219d8c3b5187493d213dd1209995996ba5a3e1","input_performance_run_id":"f3f67f96ca07595d93904e74c30fa58f","input_pipeline_artifact_hash":"ee103b8f3c1977b6a42fbe4cd5c8eef1f8206525bca2df422d15598ed014e245","input_pipeline_run_id":"583bf7242ca75c73bc906a89a5b9e2c2","input_risk_artifact_hash":"c7f439f8d36f3853bd06232996d3b4301874d9c49fa823d321530f4bf8062808","input_risk_run_id":"414e29de2d895326a6f6ea423f9b7898","monitoring_inputs_hash":"4f1a0bfe9e770dec7d5c4db4f215bd9bdb13054d59344ce89ddfc1ad9c5cbbbc","monitoring_payload_hash":"ed6676b5aab365d1a632b9c52a1f8a000cbb62dc11a7198536c488ca522ae763","monitoring_policy_hash":"c9da042bdcff575cd63021c186ec04512c61b80dba8c9dbe60fdd31297324860","monitoring_policy_version":"monitoring_policy.v1","params":{"artifacts_root":"artifacts","fail_on_critical_block":true,"warn_on_any_quality_signal":true},"quality_flags":["coverage_below_target_50","coverage_below_target_90","insufficient_calibration_data","insufficient_inputs","insufficient_uncertainty_data","zero_notional"],"quality_warnings":[{"code":"coverage_below_target_50","message":"Observed 50% interval coverage below target.","source":"forecast"},{"code":"coverage_below_target_50","message":"Observed 50% interval coverage below target.","source":"pipeline"},{"code":"coverage_below_target_90","message":"Observed 90% interval coverage below target.","source":"forecast"},{"code":"coverage_below_target_90","message":"Observed 90% interval coverage below target.","source":"pipeline"},{"code":"insufficient_calibration_data","message":"Calibration quality gate: insufficient eval sample size.","source":"forecast"},{"code":"insufficient_calibration_data","message":"Calibration quality gate: insufficient eval sample size.","source":"pipeline"},{"code":"insufficient_inputs","message":"Performance report built with fewer than two portfolio artifacts; aggregate stability is limited.","source":"performance"},{"code":"insufficient_uncertainty_data","message":"Uncertainty report has insufficient sample size.","source":"forecast"},{"code":"insufficient_uncertainty_data","message":"Uncertainty report has insufficient sample size.","source":"pipeline"},{"code":"zero_notional","message":"Portfolio run 500b1f18999652f7a341450d49242e59 has zero notional exposure.","source":"performance"}],"run_id":"25526c5f0e2d5080978a3de5d9e2c2f9"}