{"artifact_schema_version":"monitoring_report_artifact.v1","code_version":"93e488b02086","config_hash":"406414f400490d6fc925bfe9475e45811f6c09357e8512d9158f94fbe485e659","generated_at_utc":"2026-02-01T00:00:00+00:00","health_status":"WARN","health_summary":{"fail_codes":[],"n_fail_codes":0,"n_flags":4,"n_warnings":4,"sources":{"forecast":{"flags":0,"warnings":0},"performance":{"flags":2,"warnings":2},"pipeline":{"flags":1,"warnings":3},"risk":{"flags":1,"warnings":1}}},"input_forecast_artifact_hash":"ffffffffffffffffffffffffffffffffffffffffffffffffffffffffffffffff","input_forecast_run_id":"forecast-run-sample","input_performance_artifact_hash":"f00b3d21e06fe44ce5e5cc6bc16192bbe5cf69b1ab577335ab5ea694bf5856b1","input_performance_run_id":"fc03420691875675acd46f490d0b1649","input_pipeline_artifact_hash":"839b67d65e855032f4987d8023d311db2ca5bc534ba6946436c8efb7b1058463","input_pipeline_run_id":"c7571290ab9a5c198b8e1a5b3632d604","input_risk_artifact_hash":"7680747a97b554bfd3a32f234e57bd82f2aec2ba1cf9cc522cba0e3580e0127b","input_risk_run_id":"a1da31b031e251d39e60eff59ee3bef0","monitoring_inputs_hash":"fcd3cc8ac1b6c042dc734d63d0935197f56fa88a6169e13420386ee232afd88c","monitoring_payload_hash":"f9affc71f712190e5ebeb771d50d81083bb56da84f6200cb66dda770314fb100","monitoring_policy_hash":"c9da042bdcff575cd63021c186ec04512c61b80dba8c9dbe60fdd31297324860","monitoring_policy_version":"monitoring_policy.v1","params":{"artifacts_root":"artifacts","fail_on_critical_block":true,"warn_on_any_quality_signal":true},"quality_flags":["extreme_concentration_top3","illiquid","insufficient_inputs","performance_concentration_top3_breach"],"quality_warnings":[{"code":"extreme_concentration_top3","message":"Portfolio run bedfba2589365787b95cda410553e381 top3 notional share 1.000000 exceeds threshold 0.800000.","source":"performance"},{"code":"illiquid","message":"Top depth below threshold.","source":"pipeline"},{"code":"insufficient_inputs","message":"Performance report built with fewer than two portfolio artifacts; aggregate stability is limited.","source":"performance"},{"code":"performance_concentration_top3_breach","message":"Historical top3 share 1.000000 exceeds cap 0.800000.","source":"risk"}],"run_id":"d58c0d841a105dbf9673695764e790ac"}