{"artifact_schema_version":"monitoring_report_artifact.v1","code_version":"93e488b02086","config_hash":"35f02dace06347dcb4b3e1fe57a73721d6e13de7320910b12fcdca0b4c0ce86c","generated_at_utc":"2026-02-01T00:00:00+00:00","health_status":"WARN","health_summary":{"fail_codes":[],"n_fail_codes":0,"n_flags":4,"n_warnings":4,"sources":{"forecast":{"flags":0,"warnings":0},"performance":{"flags":2,"warnings":2},"pipeline":{"flags":1,"warnings":3},"risk":{"flags":1,"warnings":1}}},"input_forecast_artifact_hash":"ffffffffffffffffffffffffffffffffffffffffffffffffffffffffffffffff","input_forecast_run_id":"forecast-run-sample","input_performance_artifact_hash":"8947461dee218a996a919f0454f2d93392338e541633ba6f5cb4f63ed8ac8a3b","input_performance_run_id":"c6662c9576ac5bf49c57eee28c34c40c","input_pipeline_artifact_hash":"e58a6218df51e33f5a593fe159f7aff6922fc7ea9bcac21ee7f86c50510014b0","input_pipeline_run_id":"aa79e5253c2d5c82844cf57c039f6a86","input_risk_artifact_hash":"0fc377c5226cb30d68ef6a2478a18e8e83cf975f1493c229502296ac545fd22c","input_risk_run_id":"ea90bb11e20f510e9463fec0e4ee9fcd","monitoring_inputs_hash":"55989a9fe2bc579199d83e0cda5306b77c0a357ccd4f16a59391c407b23ae7f6","monitoring_payload_hash":"456ce92568bcab4199cf9eed4b5d3b498785c42dca977b0c258774deb3cc1a04","monitoring_policy_hash":"c9da042bdcff575cd63021c186ec04512c61b80dba8c9dbe60fdd31297324860","monitoring_policy_version":"monitoring_policy.v1","params":{"artifacts_root":"artifacts","fail_on_critical_block":true,"warn_on_any_quality_signal":true},"quality_flags":["extreme_concentration_top3","illiquid","insufficient_inputs","performance_concentration_top3_breach"],"quality_warnings":[{"code":"extreme_concentration_top3","message":"Portfolio run 6ce68484b3505454998719857f47b4f2 top3 notional share 1.000000 exceeds threshold 0.800000.","source":"performance"},{"code":"illiquid","message":"Top depth below threshold.","source":"pipeline"},{"code":"insufficient_inputs","message":"Performance report built with fewer than two portfolio artifacts; aggregate stability is limited.","source":"performance"},{"code":"performance_concentration_top3_breach","message":"Historical top3 share 1.000000 exceeds cap 0.800000.","source":"risk"}],"run_id":"878d1fdbd83a5d9ca8ff78ce929d7df7"}