{"artifact_schema_version":"monitoring_report_artifact.v1","code_version":"93e488b02086","config_hash":"c6f73b9b44370ca2dc779d0a5b5efc3a8f6b45758a4ab0a455f89131190e9f29","generated_at_utc":"2026-02-16T06:22:13+00:00","health_status":"WARN","health_summary":{"fail_codes":[],"n_fail_codes":0,"n_flags":6,"n_warnings":10,"sources":{"forecast":{"flags":4,"warnings":4},"performance":{"flags":2,"warnings":2},"pipeline":{"flags":4,"warnings":4},"risk":{"flags":0,"warnings":0}}},"input_forecast_artifact_hash":"4f53cda18c2baa0c0354bb5f9a3ecbe5ed12ab4d8e11ba873c2f11161202b945","input_forecast_run_id":"916a36568aa957fa9695fa7efbc244c9","input_performance_artifact_hash":"b4a87652ad88bbd49f579768569376db5694a2c367c568e16a623dea1d57bb27","input_performance_run_id":"678bc6ddecd15b0a811360750dce928e","input_pipeline_artifact_hash":"7173b40fbe1bab5c56dbe3c2989beec1101994f69c60da6e638d35dcd5e90e33","input_pipeline_run_id":"1d091c81eef1541ebacd9d6ba2180f6f","input_risk_artifact_hash":"bb92745ed4e44af50afc70a33dab5026faac3b1f27081b3f4aa7b47417f5e039","input_risk_run_id":"81b0370e335556f9b25859ae206d0050","monitoring_inputs_hash":"7b646da5a53b491b8f51ae066c16311a388a5b776a1a7ba6145d1ace87ca3518","monitoring_payload_hash":"5f6b0058d05b654f38d85f5b5bad2f58e431b50256db540d8fc82bd5c010ead7","monitoring_policy_hash":"c9da042bdcff575cd63021c186ec04512c61b80dba8c9dbe60fdd31297324860","monitoring_policy_version":"monitoring_policy.v1","params":{"artifacts_root":"artifacts","fail_on_critical_block":true,"warn_on_any_quality_signal":true},"quality_flags":["coverage_below_target_50","coverage_below_target_90","insufficient_calibration_data","insufficient_inputs","insufficient_uncertainty_data","zero_notional"],"quality_warnings":[{"code":"coverage_below_target_50","message":"Observed 50% interval coverage below target.","source":"forecast"},{"code":"coverage_below_target_50","message":"Observed 50% interval coverage below target.","source":"pipeline"},{"code":"coverage_below_target_90","message":"Observed 90% interval coverage below target.","source":"forecast"},{"code":"coverage_below_target_90","message":"Observed 90% interval coverage below target.","source":"pipeline"},{"code":"insufficient_calibration_data","message":"Calibration quality gate: insufficient eval sample size.","source":"forecast"},{"code":"insufficient_calibration_data","message":"Calibration quality gate: insufficient eval sample size.","source":"pipeline"},{"code":"insufficient_inputs","message":"Performance report built with fewer than two portfolio artifacts; aggregate stability is limited.","source":"performance"},{"code":"insufficient_uncertainty_data","message":"Uncertainty report has insufficient sample size.","source":"forecast"},{"code":"insufficient_uncertainty_data","message":"Uncertainty report has insufficient sample size.","source":"pipeline"},{"code":"zero_notional","message":"Portfolio run 549b6723f82657efa8528050551c2671 has zero notional exposure.","source":"performance"}],"run_id":"230d6fcbcca35bdebce6cfeb5ddc87eb"}