{"artifact_schema_version":"monitoring_report_artifact.v1","code_version":"93e488b02086","config_hash":"1f01a0f421fedade9092127cbc403b7d847495ccdd6907cd884421a63d156ea2","generated_at_utc":"2026-03-10T00:00:00+00:00","health_status":"WARN","health_summary":{"fail_codes":[],"n_fail_codes":0,"n_flags":6,"n_warnings":10,"sources":{"forecast":{"flags":4,"warnings":4},"performance":{"flags":2,"warnings":2},"pipeline":{"flags":4,"warnings":4},"risk":{"flags":0,"warnings":0}}},"input_forecast_artifact_hash":"4f53cda18c2baa0c0354bb5f9a3ecbe5ed12ab4d8e11ba873c2f11161202b945","input_forecast_run_id":"239d1cd6e6db5370a62663353ea4ded4","input_performance_artifact_hash":"0f08eaffec66839f243a2cad10a0456242c437fc585c6fd36b29ad4fc148aeb0","input_performance_run_id":"4db5a92e9ea75e07887e75355689d1ef","input_pipeline_artifact_hash":"6b16ebdaeadbb283b418edc0ed7597afba99a3fccc9d650ca6903fe39ce4d7ca","input_pipeline_run_id":"04043fe14acc58c3a864569edd216c61","input_risk_artifact_hash":"7c9875d5a8b8ee3a4e1738d66a163d29470c57225563b6482fa28cb342fac32f","input_risk_run_id":"78df8eb06abd5eaa922689785d16c5d4","monitoring_inputs_hash":"29f7cdd10bed94b876b2078cd4b38232d3b6d42d15fbf42098a339e6e684a2a4","monitoring_payload_hash":"c5c9e270b05538b3518457f329bd30c896157a8e1d03394594bcc1175faa4698","monitoring_policy_hash":"c9da042bdcff575cd63021c186ec04512c61b80dba8c9dbe60fdd31297324860","monitoring_policy_version":"monitoring_policy.v1","params":{"artifacts_root":"artifacts","fail_on_critical_block":true,"warn_on_any_quality_signal":true},"quality_flags":["coverage_below_target_50","coverage_below_target_90","insufficient_calibration_data","insufficient_inputs","insufficient_uncertainty_data","zero_notional"],"quality_warnings":[{"code":"coverage_below_target_50","message":"Observed 50% interval coverage below target.","source":"forecast"},{"code":"coverage_below_target_50","message":"Observed 50% interval coverage below target.","source":"pipeline"},{"code":"coverage_below_target_90","message":"Observed 90% interval coverage below target.","source":"forecast"},{"code":"coverage_below_target_90","message":"Observed 90% interval coverage below target.","source":"pipeline"},{"code":"insufficient_calibration_data","message":"Calibration quality gate: insufficient eval sample size.","source":"forecast"},{"code":"insufficient_calibration_data","message":"Calibration quality gate: insufficient eval sample size.","source":"pipeline"},{"code":"insufficient_inputs","message":"Performance report built with fewer than two portfolio artifacts; aggregate stability is limited.","source":"performance"},{"code":"insufficient_uncertainty_data","message":"Uncertainty report has insufficient sample size.","source":"forecast"},{"code":"insufficient_uncertainty_data","message":"Uncertainty report has insufficient sample size.","source":"pipeline"},{"code":"zero_notional","message":"Portfolio run 6f42763de453501d9bb460ca9b008cd9 has zero notional exposure.","source":"performance"}],"run_id":"950704f2f7975c1db2e08a70235c60ef"}